body,actor,postID,likes,time,class,absTime,updateTime
"Sounds promising. Will participation be open to the entire campus community?",ry_sketches,1,36,-89:30:00,,,
"Great to see free speech being prioritized. What’s the plan for putting this into action?",mads_energy,1,45,-89:30:00,,,
"Free speech? More like hate speech. You’re just trying to push your agenda.",jim_thrives,1,27,-89:30:00,,,
This is just a cover for your outdated views. No one wants to hear your boring lectures.",jim_thrives,2,10,-89:30:00,,,
"Great discussion! It’s important for us to learn how to manage our finances wisely.",em_labnotes,2,52,-89:30:00,,,
"Another pointless rally. You’re just trying to get attention for yourself.",jim_thrives,3,11,-89:30:00,,,
